{"assertions":{"acceptsAttribution":true,"bindsContext":true,"keyControl":true,"revocationRequired":true},"context":"0x","nonce":"0xabababababababababababababababababababababababababababababababab","pk":"0x0411111111111111111111111111111111111111111111111111111111111111112222222222222222222222222222222222222222222222222222222222222222","policy":{"bindingSchema":"qkb-binding-core/v1","leafHash":"0x2d00e73da8dd4dc99f04371d3ce01ecbcf4ad8e476c9017a304c57873494f812","policyId":"qkb-default-ua","policyVersion":1},"scheme":"secp256k1","statementSchema":"qkb-binding-core/v1","timestamp":1777478400,"version":"QKB/2.0"}